{
  "schema_version": "blackout.paired_series.v1",
  "series_id": "31fbf049-1eb8-48ad-b804-630f61f46c5b",
  "created_at_utc": "2026-08-12T07:32:09.956255+00:00",
  "series_config": {
    "seeds": [
      1401
    ],
    "side_swap": true,
    "model_policy_seed_base": 514001,
    "opponent_policy_seed_base": 514002,
    "time_scale": 50.0,
    "max_steps": 22000,
    "workers": 1
  },
  "episodes": [
    {
      "schema_version": "blackout.episode.v1",
      "episode_id": "62845d37-356c-4604-99b9-313e809bf80c",
      "pair_id": "seed-1401",
      "pair_index": 0,
      "seed": 1401,
      "policy_seeds": {
        "model": 515402,
        "opponent": 515403
      },
      "side_assignment": {
        "model_team": 0,
        "model_side": "A",
        "opponent_team": 1,
        "opponent_side": "B"
      },
      "model": {
        "policy_id": "model-random-v1",
        "kind": "policy-config",
        "checkpoint_path": "/Users/safeailab_macmini/Desktop/2026-IST-tech-RL/configs/policies/random_v1.json",
        "checkpoint_sha256": "08326e77ea3ed37e18948e5098de228157ed430e490c2cd4717a11fa3260c6d1"
      },
      "opponent": {
        "policy_id": "opponent-random-v1",
        "kind": "policy-config",
        "checkpoint_path": "/Users/safeailab_macmini/Desktop/2026-IST-tech-RL/configs/policies/random_v1.json",
        "checkpoint_sha256": "08326e77ea3ed37e18948e5098de228157ed430e490c2cd4717a11fa3260c6d1"
      },
      "environment": {
        "build_path": "/Users/safeailab_macmini/Desktop/2026-IST-tech-RL/builds/BlackOut.app",
        "executable_path": "/Users/safeailab_macmini/Desktop/2026-IST-tech-RL/builds/BlackOut.app/Contents/MacOS/RLGame2026",
        "executable_sha256": "49172f88b1ba2429677e7ec4a7876c4589876090be4888aeaef39269e29f4a69",
        "game_commit": "d2220a7d01be88d413f551efd529f4758833be8b",
        "python_api_commit": "6ba7d9993cf1bdefe1ed480c8efbcabcb923f539",
        "adapter": "blackout_rl.env.ContractBlackOutEnv"
      },
      "episode_length": {
        "steps": 21003,
        "wall_seconds": 394.788,
        "started_at_utc": "2026-08-12T07:18:59.063376+00:00",
        "finished_at_utc": "2026-08-12T07:25:33.850597+00:00",
        "last_time_left_normalized": 2.9206275939941406e-05
      },
      "score": {
        "team_a": 35,
        "team_b": 33,
        "model": 35,
        "opponent": 33,
        "model_minus_opponent": 2,
        "source": "last_nonterminal_info"
      },
      "winner": {
        "team": 0,
        "side": "A",
        "source": "terminal_info.winner"
      },
      "model_result": "win",
      "rewards": {
        "winner_source": "terminal_info.winner",
        "unity_shaping_used_for_winner": false,
        "unity_shaping_sum_by_agent": {
          "unit_0": 3.7000000551342964,
          "unit_1": 2.500000022351742,
          "unit_2": 3.700000062584877,
          "unit_3": 2.3000000193715096,
          "unit_4": 3.1000000461935997,
          "unit_5": 1.700000062584877,
          "unit_6": 0.30000002682209015,
          "unit_7": 0.30000002682209015,
          "unit_8": 0.30000002682209015,
          "unit_9": -0.09999998658895493
        },
        "score_delta_formula": "team=(delta_own-delta_opponent)/100",
        "score_events": 15,
        "python_score_delta_cumulative": {
          "team_a": 0.020000000000000004,
          "team_b": -0.020000000000000004
        },
        "python_terminal_bonus": {
          "team_a": 1.0,
          "team_b": -1.0
        }
      },
      "termination": {
        "kind": "time_limit",
        "all_agents_terminated": true,
        "truncated": false,
        "terminal_frame_scores_normalized": {
          "team_a": 0.0,
          "team_b": 0.0
        },
        "score_is_preterminal": true,
        "score_limitation": "Unity resets score scalars on the terminal frame; a target-score-ending deposit may not be represented in the last observable score."
      }
    },
    {
      "schema_version": "blackout.episode.v1",
      "episode_id": "ea98ad20-3bf2-4f73-ac67-e8201967c424",
      "pair_id": "seed-1401",
      "pair_index": 1,
      "seed": 1401,
      "policy_seeds": {
        "model": 515402,
        "opponent": 515403
      },
      "side_assignment": {
        "model_team": 1,
        "model_side": "B",
        "opponent_team": 0,
        "opponent_side": "A"
      },
      "model": {
        "policy_id": "model-random-v1",
        "kind": "policy-config",
        "checkpoint_path": "/Users/safeailab_macmini/Desktop/2026-IST-tech-RL/configs/policies/random_v1.json",
        "checkpoint_sha256": "08326e77ea3ed37e18948e5098de228157ed430e490c2cd4717a11fa3260c6d1"
      },
      "opponent": {
        "policy_id": "opponent-random-v1",
        "kind": "policy-config",
        "checkpoint_path": "/Users/safeailab_macmini/Desktop/2026-IST-tech-RL/configs/policies/random_v1.json",
        "checkpoint_sha256": "08326e77ea3ed37e18948e5098de228157ed430e490c2cd4717a11fa3260c6d1"
      },
      "environment": {
        "build_path": "/Users/safeailab_macmini/Desktop/2026-IST-tech-RL/builds/BlackOut.app",
        "executable_path": "/Users/safeailab_macmini/Desktop/2026-IST-tech-RL/builds/BlackOut.app/Contents/MacOS/RLGame2026",
        "executable_sha256": "49172f88b1ba2429677e7ec4a7876c4589876090be4888aeaef39269e29f4a69",
        "game_commit": "d2220a7d01be88d413f551efd529f4758833be8b",
        "python_api_commit": "6ba7d9993cf1bdefe1ed480c8efbcabcb923f539",
        "adapter": "blackout_rl.env.ContractBlackOutEnv"
      },
      "episode_length": {
        "steps": 21003,
        "wall_seconds": 395.566,
        "started_at_utc": "2026-08-12T07:25:33.889442+00:00",
        "finished_at_utc": "2026-08-12T07:32:09.455198+00:00",
        "last_time_left_normalized": 2.9206275939941406e-05
      },
      "score": {
        "team_a": 43,
        "team_b": 21,
        "model": 21,
        "opponent": 43,
        "model_minus_opponent": -22,
        "source": "last_nonterminal_info"
      },
      "winner": {
        "team": 0,
        "side": "A",
        "source": "terminal_info.winner"
      },
      "model_result": "loss",
      "rewards": {
        "winner_source": "terminal_info.winner",
        "unity_shaping_used_for_winner": false,
        "unity_shaping_sum_by_agent": {
          "unit_0": 3.0000000298023224,
          "unit_1": 3.4000000432133675,
          "unit_2": 4.800000078976154,
          "unit_3": 3.8000000566244125,
          "unit_4": 4.000000059604645,
          "unit_5": -0.3999999836087227,
          "unit_6": -0.7999999970197678,
          "unit_7": 2.9802322387695312e-08,
          "unit_8": -0.3999999836087227,
          "unit_9": -0.7999999970197678
        },
        "score_delta_formula": "team=(delta_own-delta_opponent)/100",
        "score_events": 13,
        "python_score_delta_cumulative": {
          "team_a": 0.22,
          "team_b": -0.22
        },
        "python_terminal_bonus": {
          "team_a": 1.0,
          "team_b": -1.0
        }
      },
      "termination": {
        "kind": "time_limit",
        "all_agents_terminated": true,
        "truncated": false,
        "terminal_frame_scores_normalized": {
          "team_a": 0.0,
          "team_b": 0.0
        },
        "score_is_preterminal": true,
        "score_limitation": "Unity resets score scalars on the terminal frame; a target-score-ending deposit may not be represented in the last observable score."
      }
    }
  ],
  "summary": {
    "episodes": 2,
    "wins": 1,
    "draws": 0,
    "losses": 1,
    "win_rate": 0.5,
    "mean_model_score_diff": -10.0,
    "by_model_side": {
      "A": {
        "episodes": 1,
        "wins": 1,
        "draws": 0,
        "losses": 0,
        "win_rate": 1.0,
        "mean_model_score_diff": 2.0
      },
      "B": {
        "episodes": 1,
        "wins": 0,
        "draws": 0,
        "losses": 1,
        "win_rate": 0.0,
        "mean_model_score_diff": -22.0
      }
    },
    "by_physical_side": {
      "A": {
        "episodes": 2,
        "wins": 2,
        "draws": 0,
        "losses": 0,
        "win_rate": 1.0,
        "mean_score_diff": 12.0
      },
      "B": {
        "episodes": 2,
        "wins": 0,
        "draws": 0,
        "losses": 2,
        "win_rate": 0.0,
        "mean_score_diff": -12.0
      }
    },
    "side_bias_diagnostics": {
      "model_side_win_rate_gap_a_minus_b": 1.0,
      "physical_win_rate_gap_a_minus_b": 1.0,
      "mean_score_diff_a_minus_b": 12.0,
      "balanced_model_side_exposure": true,
      "model_result_attribution_consistent": true,
      "evaluator_side_attribution_passed": true
    },
    "winner_derived_from_unity_shaping": false
  }
}
